{
  "$schema": "./third_party_components.schema.json",
  "name": "nakagawa-recomp-third-party-components",
  "schema_version": 1,
  "description": "Single machine-readable source of truth for every third-party component that can enter a release artifact. tools/package_notices.py (native package), tools/generate_sbom.py (SBOM) and tools/test_third_party_notices.py (release gate) all read this file. A component without a spdx_id, a license text in the tree, and (for Python tools) a recorded license fails the gate.",
  "version_source_policy": "No version literal is trusted. Native DLL versions are read from the toolchain's own pacman database (var/lib/pacman/local/<pkg>/desc); Python and npm versions are read from the declared lockfiles. Every license text under third_party/licenses/ was copied verbatim from the component's own distribution in the local toolchain; each record below names the exact file it was copied from.",
  "native": {
    "copy_routes": [
      {
        "id": "compile-asset-copy",
        "file": "tools/copy_build_assets.ps1",
        "copies": [
          "SDL3.dll",
          "libgcc_s_seh-1.dll",
          "libwinpthread-1.dll",
          "libstdc++-6.dll"
        ],
        "note": "The three MinGW/UCRT runtime DLLs are copied only when a bundled .exe/.dll in the build directory actually imports them (objdump -p 'DLL Name' match). The conditional does not narrow the notice obligation: every DLL this route can copy must carry a license record."
      },
      {
        "id": "player-typography-runtime",
        "file": "tools/stage_runtime_dlls.py",
        "copies": [
          "SDL3.dll",
          "SDL3_ttf.dll",
          "libfreetype-6.dll",
          "libharfbuzz-0.dll",
          "libgraphite2.dll",
          "libglib-2.0-0.dll",
          "libintl-8.dll",
          "libiconv-2.dll",
          "libpcre2-8-0.dll",
          "libpng16-16.dll",
          "zlib1.dll",
          "libbz2-1.dll",
          "libbrotlidec.dll",
          "libbrotlicommon.dll",
          "libgcc_s_seh-1.dll",
          "libstdc++-6.dll",
          "libwinpthread-1.dll"
        ],
        "note": "Mechanical PE-import closure of SDL3.dll and SDL3_ttf.dll (objdump -p with the pure-Python PE fallback), recursively, stopping at Windows system DLLs; staged beside build/nakagawa_player.exe and into built packages (#421). The closure is resolved at staging time and fails closed on any unresolved non-system import; this list is the license obligation that follows it."
      }
    ],
    "host_resolved_dlls": [
      "vulkan-1.dll"
    ],
    "system_dll_patterns": [
      "^api-ms-win-.*\\.dll$",
      "^ext-ms-win-.*\\.dll$",
      "^(kernel32|kernelbase|user32|gdi32|shell32|ole32|oleaut32|advapi32|setupapi|imm32|version|winmm|comctl32|comdlg32|shlwapi|ws2_32|wsock32|dnsapi|iphlpapi|netapi32|userenv|uxtheme|dwmapi|d3d[0-9a-z_]*|dxgi|dinput[0-9a-z_]*|xinput[0-9a-z_]*|mfplat|mf|mfreadwrite|mfuuid|ntdll|msvcrt|ucrtbase|dwrite|rpcrt4|usp10|bcrypt|winhttp)\\.dll$"
    ],
    "dlls": {
      "sdl3.dll": {
        "name": "SDL3",
        "notice_file": "SDL3.txt",
        "spdx_id": "Zlib",
        "pacman_package": "sdl3",
        "upstream_origin": "https://github.com/libsdl-org/SDL",
        "disposition": "copied_into_package",
        "license_texts": [
          {
            "file": "third_party/licenses/sdl3/LICENSE.txt",
            "copied_from": "MSYS2 UCRT64 package mingw-w64-ucrt-x86_64-sdl3: ucrt64/share/licenses/SDL3/LICENSE.txt",
            "toolchain_license_rel": "share/licenses/SDL3/LICENSE.txt",
            "sha256": "1c040b8271b37e5076359f8fd54240e371114112924d2df81ef87c7d6a1dfdfd"
          }
        ]
      },
      "sdl3_ttf.dll": {
        "name": "SDL3_ttf",
        "notice_file": "SDL3_ttf.txt",
        "spdx_id": "Zlib",
        "pacman_package": "sdl3-ttf",
        "upstream_origin": "https://github.com/libsdl-org/SDL_ttf",
        "disposition": "copied_into_package",
        "license_texts": [
          {
            "file": "THIRD_PARTY_LICENSES/SDL3_ttf.txt",
            "copied_from": "MSYS2 UCRT64 package mingw-w64-ucrt-x86_64-sdl3-ttf: ucrt64/share/licenses/SDL3_ttf/LICENSE.txt",
            "toolchain_license_rel": "share/licenses/SDL3_ttf/LICENSE.txt",
            "sha256": "7826eca0a0f7e591f38dd844e207a200aac81a59b20d8a30c3af8c6282af13e6"
          }
        ]
      },
      "libfreetype-6.dll": {
        "name": "FreeType",
        "notice_file": "FreeType-FTL.txt",
        "spdx_id": "FTL",
        "pacman_package": "freetype",
        "upstream_origin": "https://gitlab.freedesktop.org/freetype/freetype",
        "disposition": "copied_into_package",
        "note": "FreeType is dual-licensed FTL or GPL-2.0-or-later; this distribution uses the FTL option, which the FSF lists as GPL-compatible.",
        "license_texts": [
          {
            "file": "THIRD_PARTY_LICENSES/FreeType-FTL.txt",
            "copied_from": "MSYS2 UCRT64 package mingw-w64-ucrt-x86_64-freetype: ucrt64/share/licenses/freetype/FTL.TXT",
            "toolchain_license_rel": "share/licenses/freetype/FTL.TXT",
            "sha256": "5a5ee54c5001bbad1cdc1a57cc3dd4c42199b2da09d39c7ee41fab002d02967f"
          }
        ]
      },
      "libharfbuzz-0.dll": {
        "name": "HarfBuzz",
        "notice_file": "HarfBuzz.txt",
        "spdx_id": "MIT",
        "pacman_package": "harfbuzz",
        "upstream_origin": "https://github.com/harfbuzz/harfbuzz",
        "disposition": "copied_into_package",
        "license_texts": [
          {
            "file": "THIRD_PARTY_LICENSES/HarfBuzz.txt",
            "copied_from": "MSYS2 UCRT64 package mingw-w64-ucrt-x86_64-harfbuzz: ucrt64/share/licenses/harfbuzz/COPYING",
            "toolchain_license_rel": "share/licenses/harfbuzz/COPYING",
            "sha256": "ba8f810f2455c2f08e2d56bb49b72f37fcf68f1f4fade38977cfd7372050ad64"
          }
        ]
      },
      "libgraphite2.dll": {
        "name": "Graphite2",
        "notice_file": "Graphite2.txt",
        "spdx_id": "MIT",
        "pacman_package": "graphite2",
        "upstream_origin": "https://github.com/silnrsi/graphite",
        "disposition": "copied_into_package",
        "note": "Upstream grants a four-way choice (LGPL-2.1+, MPL-2.0, GPL-2.0+, or MIT) per its LICENSE; this distribution uses the MIT option. The copied text carries all four grants in full where required.",
        "license_texts": [
          {
            "file": "THIRD_PARTY_LICENSES/Graphite2.txt",
            "copied_from": "MSYS2 UCRT64 package mingw-w64-ucrt-x86_64-graphite2: ucrt64/share/licenses/graphite2/LICENSE",
            "toolchain_license_rel": "share/licenses/graphite2/LICENSE",
            "sha256": "cab46cd45adbfea4b1d0f14b033c70062c73074fa0b56532c2f351576ddf455e"
          }
        ]
      },
      "libpng16-16.dll": {
        "name": "libpng",
        "notice_file": "libpng.txt",
        "spdx_id": "libpng-2.0",
        "pacman_package": "libpng",
        "upstream_origin": "http://www.libpng.org/pub/png/libpng.html",
        "disposition": "copied_into_package",
        "license_texts": [
          {
            "file": "THIRD_PARTY_LICENSES/libpng.txt",
            "copied_from": "MSYS2 UCRT64 package mingw-w64-ucrt-x86_64-libpng: ucrt64/share/licenses/libpng/LICENSE",
            "toolchain_license_rel": "share/licenses/libpng/LICENSE",
            "sha256": "bdb0a645ea18c60507d0368379b1ac5474b92255fcc2d115e07486a7672ba526"
          }
        ]
      },
      "zlib1.dll": {
        "name": "zlib",
        "notice_file": "zlib.txt",
        "spdx_id": "Zlib",
        "pacman_package": "zlib",
        "upstream_origin": "https://zlib.net/",
        "disposition": "copied_into_package",
        "license_texts": [
          {
            "file": "THIRD_PARTY_LICENSES/zlib.txt",
            "copied_from": "MSYS2 UCRT64 package mingw-w64-ucrt-x86_64-zlib: ucrt64/share/licenses/zlib/LICENSE",
            "toolchain_license_rel": "share/licenses/zlib/LICENSE",
            "sha256": "e32ff4e00d9d94930537635291da39e7e612703334bf6fde8c7f1686fe8a45a2"
          }
        ]
      },
      "libbz2-1.dll": {
        "name": "bzip2",
        "notice_file": "bzip2.txt",
        "spdx_id": "bzip2-1.0.6",
        "pacman_package": "bzip2",
        "upstream_origin": "https://sourceware.org/bzip2/",
        "disposition": "copied_into_package",
        "license_texts": [
          {
            "file": "THIRD_PARTY_LICENSES/bzip2.txt",
            "copied_from": "MSYS2 UCRT64 package mingw-w64-ucrt-x86_64-bzip2: ucrt64/share/licenses/bzip2/LICENSE",
            "toolchain_license_rel": "share/licenses/bzip2/LICENSE",
            "sha256": "c6dbbf828498be844a89eaa3b84adbab3199e342eb5cb2ed2f0d4ba7ec0f38a3"
          }
        ]
      },
      "libbrotlidec.dll": {
        "name": "Brotli (decoder)",
        "notice_file": "Brotli.txt",
        "spdx_id": "MIT",
        "pacman_package": "brotli",
        "upstream_origin": "https://github.com/google/brotli",
        "disposition": "copied_into_package",
        "license_texts": [
          {
            "file": "THIRD_PARTY_LICENSES/Brotli.txt",
            "copied_from": "MSYS2 UCRT64 package mingw-w64-ucrt-x86_64-brotli: ucrt64/share/licenses/brotli/LICENSE",
            "toolchain_license_rel": "share/licenses/brotli/LICENSE",
            "sha256": "3d180008e36922a4e8daec11c34c7af264fed5962d07924aea928c38e8663c94"
          }
        ]
      },
      "libbrotlicommon.dll": {
        "name": "Brotli (common)",
        "notice_file": "Brotli.txt",
        "spdx_id": "MIT",
        "pacman_package": "brotli",
        "upstream_origin": "https://github.com/google/brotli",
        "disposition": "copied_into_package",
        "license_texts": [
          {
            "file": "THIRD_PARTY_LICENSES/Brotli.txt",
            "copied_from": "MSYS2 UCRT64 package mingw-w64-ucrt-x86_64-brotli: ucrt64/share/licenses/brotli/LICENSE",